,0,1
8075,코로나가 이렇게 심한데 왜 다들 여행을 다니는거야,0
8076,그냥 이제 코로나 그러려니 하는 듯,0
8077,나도 500만원 빌려줬다가 여자 잠수 타서 난리났던 적 있음,0
8078,나 어제 갔던 술집에서 카드를 잃어버렸나봐 ㅠㅠ,0
8079,어쩐지 술독에 빠진 것처럼 퍼마시더라니...,0
8080,경찰들 범죄자 무섭다고 도망갔대,0
8081,자격 안되는 경찰들은 물갈이 해야되는 거 아닌가,0
8082,"그러니까, 국가 치안을 지키는게 경찰인데....",0
8083,피해자들은 어디 의지해,0
8084,그래도 가끔 획기적인 말 하던데?,0
8085,야동은 인간적으로 보게 해줘야지,0
8086,우리나라 남자들은 야동 보면 성범죄 저지를 생각만 해서 안돼,0
8087,미용사들이 언제부터 선생님이 됐냐,0
8088,이거 조직적 불법선거아니야?,0
8089,나도 정권교체고 뭐고 이제 당에 미련이 없게 됨,0
8090,어디 누구 말하는데?,0
8091,저기 왼쪽 끝에 있는 사람봐바.,0
8092,와.. 진짜 토나올거 같네,0
8093,심각하긴 심각하네.,0
8094,뚱뚱한 사람도 필라테스 다녀도 돼?,0
8095,아니 먼저 헬스 다니면서 살부터 빼야돼,0
8096,필라테스는 체형 교정이 목적인 운동이라서!,0
8097,아 그러면 헬스 한달정도 다니고 다녀야 겠다,0
8098,중국 저렇게 좋아하는데 왜 안 데려가냐,0
8099,음대에서는 그 형이 제일 많이 권위적이었지,0
8100,요즘 영화 보면 너무 잔인하지 않냐?,0
8101,어 맞아 무슨 생각으로 영화 만드는지 모르겠어,0
8102,너네 학교 교양 수업 중에 데이트하는 수업 있다며?,0
8103,그래도 꽤 재밌어 보이던데?,0
8104,OO 엉덩이에 박고 싶다,2
8105,나는 OO 내 스타일은 아니야,0
8106,너무 부담스러워,0
8107,그래? 나는 센 여자가 좋던데,0
8108,너는 몸에 털이 왜이렇게 많냐,0
8109,내 콤플렉스야..,0
8110,진짜 무슨 짐승 같아 ㅋㅋㅋ,0
8111,적당히 해,0
8112,짜증나니까 그만하라고,0
8113,저 후보 말 한 마디 한 마디 진짜 가관이야,0
8114,웹툰 박람회 가서 오피스 누나 들어간 제목 보고 확 끌린다고 했잖아,0
8115,다시 말해 예쁘장하게 생긴 젊은 여직원한테 발기된단 거잖아,2
8116,도대체 무슨 뜻으로 그런 말을 한 거야 정말,0
8117,오죽하면 일가친척이 저런 탄원서를 냈겠어,0
8118,제 2의 OO이 나올 뻔 했어 휴..,0
8119,다이어트 자극되네...,0
8120,진짜 이번엔 잘 좀 해보자!,0
8121,나도 열심히 하고 있어...,0
8122,그러니까 조금만 더 참아봐,0
8123,알겠어 식단 열심히 할게ㅠ,0
8124,연예계는 스폰서 많다고 하잖아.,0
8125,그런 애들은 관종인가? 이상한 사람 너무 많아,0
8126,진짜 한다고 생각하니까 구토 나올 거 같음 어우...,0
8127,모든 여자들은 역시 뒷태가 짱이야,2
8128,그게 무슨 소리야?,0
8129,선배들이 다 그러던데?,0
8130,방금 지나가는 아가씨 봤냐?,0
8131,너도 본거야? 완전 쭉쭉빵빵하지 않냐?,2
8132,진짜 쭉쭉빵빵하다.,2
8133,가슴이 여자보다 더 튀어나온 근육맨들 아니겠냐?,2
8134,나는 살이 많이 쪄서 저 여자보다 가슴은 클꺼같은데,2
8135,정신차리고 우리도 운동해서 저런 쭉쭉빵빵 이쁜 여자 만나보자,2
8136,OO 이제 와서 과거 세탁 하려는 건가,0
8137,갑자기 선행 여러 개 베푸네,0
8138,원래 대선되면 후보들 다 그러든데,0
8139,시장 돌고 어묵 먹고 그러잖아,0
8140,아 ㅋㅋㅋ 여자들 기 싸움은 도대체 왜 하는거냐,0
8141,괜히 거기 끼어들었다가 인생 망한다 ㅋㅋ,0
8142,알았어 조언 고맙다,0
8143,그집은 세 모녀가 너무 다르게 생겼더라.,0
8144,성형수술을 각자 취향대로 했구만. ㅋㅋㅋㅋ,0
8145,우리집처럼 한 병원에서 같이 하면 아무도 몰라서 시침 떼기 좋은데.,0
8146,와 방송에서까지 남자를 저렇게 갖고 노네,0
8147,남자들은 저런 여자 구별을 하나도 못하더라,0
8148,엥 얼굴 못생겨서 댄서 된 거 아닌데…,0
8149,절절한 사랑 하시는 중이구만,0
8150,저 여자는 승무원 되는게 꿈이래,0
8151,이 자식 댓글 맞는 내용이 하나도 없네,0
8152,그럴 거면 댓글 뭐하러 다냐?,0
8153,네가 뭔데 남의 댓글 와서 아는 척이야?,0
8154,저 여자는 고소당해도 싸다,0
8155,단지 길을 걸어가고 있을 뿐인데 왜?,0
8156,너무 섹시해서 남자들 액 소멸죄로 고소당해야 해,2
8157,그거라면 인정이다ㅋㅋㅋ,0
8158,남이 뭘 하고 살든 무슨 상관이야?,0
8159,OO 처음 나왔을때랑 반응이 전혀 다르잖아,0
8160,자리가 비어 있어서 경로석에 앉았다가 봉변당했어.,0
8161,왜 무슨 일 있었어?,0
8162,니가 서운하게 한건 아니고?,0
8163,이거 무슨 냄새야?,0
8164,옆집에서 아무래도 메주를 띄우나봐,0
8165,그래도 인심 무지 좋은 분이야,0
8166,나는 인상도 그다지 좋지 않아보이던데,0
8167,너무 나쁘게만 생각하지마,0
8168,참 사람 심보 악하다,0
8169,어떻게 아무 죄도 없는 콜센터 직원한테 그런 막말을 하냐?,0
8170,이딴 글 보면 진짜 힘 빠진다...,0
8171,일본인들은 인종차별 안한대,0
8172,뭐래. 정치인들도 많은데 뭔소리 하냐,0
8173,잘 모르면 찾아봐~,0
8174,차별금지법에 성소수자만 해당되는 거 아님,0
8175,갑자기 빵 뜬 연예인들은 다 의심해 봐야해,0
8176,피자를 맛없게 하기도힘들겠다 ㅋㅋ,0
8177,당신이 말한 그문장 탈룰라 시전이 가능할수도 있습니다,0
8178,이 사람 체형 되게 부럽다,0
8179,너 그렇게 살다가는 폐암이나 간암 중에 하나 걸려서 죽을 것 같아,0
8180,"술, 담배 어떻게 끊는 거냐...",0
8181,나 진짜 중독인가봐...,0
8182,잠깐 자숙하다가 슬슬 복귀각 잡을 듯.,0
8183,남자 아이돌이 팬들 몰래 여자 만나고 다녔대.,0
8184,와 진짜 대박인데?,0
8185,걔넨 몰랐는데 뭐가 잘못있겠어,0
8186,어떤 놈이길래,0
8187,OO 전여친은 친구들이 다 돌아섰네.,0
8188,완전 다 여론이 안좋은 쪽으로 변했어.,0
8189,친구들도 오죽했으면 그랬겠냐고.,0
8190,독립출판 서적만 취급하는 서점이라고 그래서 기대하고 갔는데 생각보다 별로였어,0
8191,그러게 수준이 그냥 SNS에서 퍼온 글 같기도 하고,0
8192,저 그때 새엄마한테 맞은거 정말로 아무한테도 말 안했어요,0
8193,지들이 독립투사나 애국지사인줄 알지,0
8194,아프간 협력자하고 가족들이 오늘 인천국제공항에 입국했대,0
8195,스포츠 의류 원가 대비 가격 거품 너무 심해,0
8196,실제로도 그래.,0
8197,여자도 군대 가야하는거 아니야?,0
8198,자기 일 열심히 하는 여자가 섹시해,0
8199,OO은 정말 예쁘고 연기까지 잘 하는 배우,0
8200,한국여자들 일본가면 일본남자들한테 인기 엄청 많다는데?,0
8201,일본남자들이 그렇단 말이야...?,0
8202,오늘 할로윈 축제 한다고 OO 난리네?,0
8203,요즘 대학생들 좀 불쌍하다,0
8204,OO 걸려도 학교 가겠다는 강단이 좀 있어야지,0
8205,쟤 코트 수천만원 짜리래.,0
8206,그리 비싼 코트도 있어?,0
8207,우린 그리 살지말자,0
8208,"그놈의 촛불 타령, 지겹지도 않냐?",0
8209,"작년, 유럽을 갔는데 파스타를 시켰더니 4만원이 나온거 있지?",0
8210,그래. 물가는 동남아가 최고지!,0
8211,맞아 유럽보다 동남아가 날씨도 좋고 물가도 싸고!,0
8212,원팀은 말도 안 되지,0
8213,절대 안 되지,0
8214,그렇다고 저 사람한테 심한 악플까지 달고 그런 애들도 문제가 있지.,0
8215,다음주 월요일부터 출근이었는데 입사 취소당함,0
8216,그럴거면 면접 때 미리 말해주든가,0
8217,다른 입사 제의 온 곳까지 다 거절했는데 황당하네,0
8218,뭐 그런 회사가 다 있냐?,0
8219,백신 안 맞은 사람들 도태가 시작되는구만,0
8220,야 백신 접종자와 미접종자를 똑같이 대우해주는게 오히려 차별 아니냐?,0
8221,미국은 다니던 회사에서도 해고당해,0
8222,와 미식축구 선수들은 뇌 질환이 되게 많은가봐,0
8223,은퇴하고 나서 일찍 죽는 경우가 많네,0
8224,의사라더니 말하는 게 좀 그렇다,0
8225,둘 다 문제가 있는 건 마찬가지인듯,0
8226,OO은 왕이 될 상이 아니야,0
8227,차라리 OO가 대선 후보로 나오는 게 더 나을 듯,0
8228,저 물 하나만 가져가도 될까?,0
8229,아뇨 무료로 제공되는 물이 아닙니다.,0
8230,남자 아이돌들 너무 말랐다.,0
8231,막 56kg 나가는 애들도 있던데,0
8232,와 진짜 키도 상대적으로 크잖아 남자들은...,0
8233,내가 발로 차면 바로 날라갈 거 같음,1
8234,아프가니스탄 부모들이 아기라도 살라고 철조망 밖으로 외국 군대한테 던지는 상황이 너무 마음 아프다,0
8235,OO 같은 애한테 여자친구가 있었다는 게 놀랍네,0
8236,OO도 꾸미면 잘생기기도 했고,0
8237,협찬 받아놓고 피해자인 척 하는 건 상도덕 위반 맞지.,0
8238,니 그 쩝쩝대는 소리때문에 일에 집중할 수가 없잖아,0
8239,너는 먹는거 가지고 왜 그러냐?,0
8240,이 회사는 음식 먹을 자유도 없냐?,0
8241,넌 남한테 피해주며 자유 찾니?,0
8242,이참에 좀 젊고 신선한 정치인 나와주면 좋겠네,0
8243,알바생 마음에 드는데 번호 딸까?,0
8244,열심히 일 하려는 애 괴롭히지마,0
8245,이게 왜 괴롭히는거야?,0
8246,사람대 사람으로 소통하려고 하는거지~,0
8247,와 옷을 저렇게 못 생기게 만들어 놨네 ㅋㅋㅋ,0
8248,갓양인 모델도 체념했다 ㅋㅋㅋ 표정봐라,0
8249,입고다니면 걸어다니는 콘돔이네 그냥 ㅋㅋㅋㅋ,2
8250,모세의 기적 마냥 여자들이 다 피해 갈 듯,0
8251,코스프레나 애니 좋아하는 애들은 오히려 환장할 수도 있겠는데?,0
8252,와 상상도 하기 싫어 그냥 지나가라 그래 오덕 여자애들은 ㅋㅋ,0
8253,OO 이번 논란은 ㄹㅇ 실망임.,0
8254,선하게 생겨서 그럴 사람으로 안보였는데...,0
8255,솔직히 얼굴 보고 어떻게 알아.,0
8256,남자들 수염 기르는 거 어떻게 생각해?,0
8257,그냥 지저분해 보여,0
8258,OO 정도 얼굴 아니면 기를 생각 하지 마라,0
8259,엥? 갑자기 왜그래?,0
8260,미안해 못했었네?,0
8261,오늘 OO뮤뱅 나온거 직캠 개잘생김..,0
8262,아이돌 좋아하는게 범법행위도 아닌데 왜그러세요,0
8263,중국에서는 7초마다 사람이 죽는대.,0
8264,인구가 많아서 그런 거 같아.,0
8265,쟤가 어제 나한테 우리 엄마 욕했다.,0
8266,밤 열한 시인데 치킨 먹고 싶다,0
8267,야식은 건강에 안 좋으니까 참았다가 내일 점심으로 먹어,0
8268,부모가 보면 참 가관이겠지만 나중에 시부모가 보면 기겁하겠다,0
8269,중국에서 희토류가지고 배짱 장사 한다더라,0
8270,희토류가 그렇게 귀한 자원인가?,0
8271,흔하긴 한데 환경오염 때문에 그러는거지,0
8272,화성에는 왤케 살인사건이 많이 일어나냐,0
8273,너무 영화같은 일이어서 현실인가 싶네요,0
8274,니가 뭘 안다고 그래,0
8275,그래 그럴 줄 알고 있지만 시도는 해봐야지,0
8276,핼러윈이 뭐라고 밖에 싸돌아다니냐,0
8277,인싸들 부러워서 그러냐,0
8278,부러우면 너도 나오면 되잖아,0
8279,OO모발이식 왜 한줄 알아?,0
8280,배부르다 자야지 이제,0
8281,믿을 건 내 통장 잔액 뿐이다...,0
8282,근데 너무 빈약해 ㅋㅋㅋ,0
8283,아직도 지역 감정 유발하는 사람있나?,0
8284,지역 감정 유발해서 본인들한테 도움되는 게 뭐있다고ㅠㅠ,0
8285,양남을 데려와라~,0
8286,쟤가 입은 티셔츠 좀 봐봐 만화 캐릭터 그려져 있어,0
8287,사진을 이렇게 찍지 말고 수평을 맞춰서 찍어야지,0
8288,넌 내가 그냥 사진 찍는 기계나 삼각대 정도로 보이지?,0
8289,너 같은 애는 사회에 있어봤자 도움도 안 돼,0
8290,나 나름 잘 살고 있어,0
8291,과연 그럴까?,0
8292,니가 뭔데 단정해,0
8293,넌 얼마나 잘 살고 있길래 그래?,0
8294,적어도 너보단 가치 있는 삶을 살고 있어,0
8295,이거 진짜임  자판기 뚜들겨패서 고장 냄,0
8296,할로윈 데이 때 OO 거리 봤냐?,0
8297,분장한 사람들로 진짜 꽉 차있더라.,0
8298,외국인이냐? 한국에서 한복을 매도해?,0
8299,그렇게 농구할거면 하지말지. 농구공 머리에 던지고싶다,1
8300,맞아 나도 던지고싶어. 너무 못해 게으른 자식들ㅋ,1
8301,왜 애를 안 낳는지 진짜 몰라서 저런 정책 만드는 건가?,0
8302,내 한 몸 살기도 힘든데 이런 지옥에서 살으라고 애를 낳아?,0
8303,OO 패션쇼에서 진짜 멋지더라,0
8304,치명적인척도 자신있어야 할 수 있는거야,0
8305,아무리 좋은 사람이 나와도 OO은 안 뽑는다고,0
8306,맞아 쟤네는 사람을 보고 뽑는 게 아니라 당을 보고 뽑잖아,0
8307,그러니까 OO 같은 무능한 대통령이 나오지,0
8308,야 그래도 저 사람들은 당한 게 많잖아,0
8309,몰라 쟤들은 언제까지 광주타령이나 할 거임?,0
8310,이런 상황에서도 용서하고 나 너무 한심하지,0
8311,빵셔틀 한부대는있었을듯,0
8312,요즘 개발자 연봉 4500이면 낮은편인데,0
8313,나도 자주 그러는데...,0
8314,솔직히 이런 현생을 너가 뭘 이해한다고 말질이야?,0
8315,그렇게 살면서 뭔 대답을 듣길 바라냐?,0
8316,이 위험한데로 들이닥치다니 대체 생각이 있나 없나,0
8317,그러니 왜 나를 먼저 건드려서 이 지경을 만들어?,0
8318,뭘 하면서 살든 너랑 무슨 상관이라구..,0
8319,지금부터라도 기회를 줄테니 새롭게 출발을 해봐,0
8320,기회가 아니라 굽신거리고 다시 살아라는 말이네.,0
8321,백신 부작용 비율 통계 좀 빨리 내봐라,0
8322,아무리 한녀라지만 이건 좀 말이 심하네,0
8323,강아지 입을 공업용 고무줄로 묶어놓다니 너무 끔찍하고 가슴이 아프다,0
8324,결과를 어떻게 선수들 맘대로 할 수 있겠어?,0
8325,애 없을때 이혼하세요 애 생기면 죽도 밥도 안 됨,0
8326,쟤네들 교리 자체가 근데 원래 그렇기는 함,0
8327,저 정도로 몸매 좋은 한국 여자들도 많아ㅋ,0
8328,백신 맞고 부작용으로 죽은 사람들 왜 죽었는지는 알아야 되는 거 아니냐?,0
8329,오랜만에 OO 이 티비에 나왔네?,0
8330,지방대도 지방대 나름이야!,0
8331,그래 밝아서 좋네 ㅋㅋ,0
8332,지방대 놀러와 한번~,0
8333,ㅋㅋ 알겠다 친구야~,0
8334,공기도 좋고 시설도 꽤 좋단 말이지,0
8335,오늘 먹은 카레 어땠어?,0
8336,개존맛 내일 또 먹자,1
8337,ㅇㅇ존좋 그래그래,1
8338,그 놈의 28만원은 마르지 않는 샘인가,0
8339,나는 술 중에 양주가 제일 맛있더라 소주는 숙취가 심해서 싫어,0
8340,숙취가 제일 없는 양주를 좋아하는게 그렇게 욕 먹을 일이니? 너무한다,0
8341,왜? 무슨 이유로 그러는거야?,0
8342,자랑할 게 가슴 밖에 없는지 니가 어떻게 알아?,0
8343,자랑할 게 더 늘어난 거 일수도 있잖아.,0
8344,아 오늘도 한주가 너무 길다 진심,0
8345,그런 나랑 놀아줘서 고맙다...,0
8346,ㅋㅋ 나도 찐따라서 괜찮아,0
8347,우린 진짜 잘 맞긴 해,0
8348,나도 그렇게 생각해 ㅋㅋㅋ,0
8349,우리 이제 밥이나 먹으러 가자 ㅋ,0
8350,OO은 뭐하는 사람이야 대체?,0
8351,평생 진심이 담긴 사과는 안 해본 거 같다,0
8352,OO 안 나왔으면 했다,0
8353,OO에 또 나오네,0
8354,아 감자탕 먹고 싶다,0
8355,너는 이 시간에도 먹고 싶은 게 생각나냐?,0
8356,제발 운동도 하고 살도 빼라,0
8357,부산 사투리 정신줄 놓고 들으면 일본어처럼 들리던데,0
8358,아니 삼청교육대 얼마나 안 좋은 곳이었던 거냐,0
8359,환향녀라는 말은 나라가 백성을 지켜주지 못해서 생긴 너무 아픈 비극이다,0
8360,요즘 공익들이 너무 많다 ㅋㅋ,0
8361,전쟁나면 다 뚫리겠네,0
8362,언제는 OO가 중국보다 낫다 하더니,0
8363,OO는 가발만 쓰면 진짜 웃기다 ㅋㅋㅋ,0
8364,역할 같은 거 정해주면 진짜 잘 살리는 것 같아,0
8365,맞아 바보 같은 잘해서 보는 재미가 더해지더라.,0
8366,여친한테 라벨 프린터 사줬는데 차라리 그 돈으로 메이커있는 목걸이를 사라고 욕먹었다.,0
8367,왜 개목줄을 안 채우고 쏘다니는 거에요?,0
8368,담에 보면 발로 줘차버려도 되죠?,1
8369,"죄송합니다, 죄송합니다",0
8370,이 동네는 고양이들이 참 많아,0
8371,고양이는 병 옮기고 쓰레기 흐트려 놓고 없어져야 할 동물이야,0
8372,다 믹서기에 넣고 갈아버려야대,1
8373,OO 같은 책 보면 무슨 젊은 사람들한테 모든 걸 맞춰야 되는 것처럼 써있던데,0
8374,그네들이 이제 이 세상 주인이니 우리 같은 사람들이 맞춰야하지 않겠어?,0
8375,각자가 경험이 다르고 생각이 다르고 한거지 뭐가 옳고 뭐가 그르다 이분법적으로 보면 안되는거지,0
8376,우리가 교육받던 상황이랑 또 다르니까 우리랑은 다른 타입의 사람들인거겠지 수준차이라기보다는,0
8377,아무튼 난 그래…젊은 친구들이 좀 답답하게 느껴져,0
8378,나 가끔 비키니 쇼핑몰 눈팅함,0
8379,골반 넓은데 허벅지 얇아서 오므려도 안 겹치는거 대꼴,2
8380,이건 좀 혐오스럽다,0
8381,쎈척 하는게 아니라 진짜 쎈거임,0
8382,진짜 너무시끄러운거 아니냐,0
8383,어디서나는소린거야 윗층?,0
8384,라면을 시켰는데 다 팅팅 불은 걸 줬어,0
8385,다시 끓여 달라 해,0
8386,아 또 기다려야 되잖아,0
8387,백신맞기 싫다고 미인대회 출전 포기한 여자가 있네,0
8388,백신은 그냥 핑계인 걸지도?,0
8389,아 진짜 싫다,0
8390,똥마련 강아지처럼 왜이리 안절부절 못해?,0
8391,나도 이젠 집구석에만 처 박혀있는 어린애가 아니라구요,0
8392,쓸개 빠진 모자란 년도 아니고 그렇게 울타리를 넘고싶으냐?,1
8393,나 이래 물속에서 허우적 거리듯이 더는 못 살겠단 말입니다,0
8394,저 계집년을 그만 죽여버릴까부다,1
8395,그러게 말이야~,0
8396,OO 갑자기 깐부 거리네,0
8397,저 OO 지지자냐?,0
8398,OO은 이름만 비슷하고 치킨집이니 패러디 느낌이라 귀여움,0
8399,나는 OO 엄청 맛없던데 순전히 이름 때문에 유명한 듯,0
8400,시골인데 제주도에도 이마트가 있네,0
8401,예쁘기만 한데.,0
8402,둘 다 무쌍 여신이야,0
8403,쟤네 진짜 매력적인 얼굴인데 뭘 모르네.,0
8404,그러니까 여주인공 자리 매번 꿰차지.,0
8405,여자들한테 욕 먹는 한이 있더라도 거짓말은 못하겠다,0
8406,OO 교수님 같애.,0
8407,인성 좋고 점잖은 교수님 같은 이미지임,0
8408,맞아. 목소리에서 인품이 보임.,0
8409,그러면 OO 목소리는 어떰?,0
8410,예쁘면 세상 살기 편하더라,0
8411,나 정도면 예쁜 편이지..ㅋㅋ,0
8412,너 자존감 굉장히 높구나?,0
8413,객관적으로 나 같은 애 어디 없어~,0
8414,왜 나한테 어필을 하고 난리야 ㅋㅋㅋ,0
8415,카페 식당 인원제한 하는건 이해하겠다고,0
8416,이 영화 봤어?,0
8417,아니ㅠㅠ,0
8418,인성으로 영업하더니 결국 망해버렸네,0
8419,맞아 나도 진짜 충격받았어,0
8420,역시 아이돌을 인성으로 파면 안 될 듯,0
8421,이 치어리더 이쁘지 않냐,0
8422,이쁘긴 한데 꼴리지가 않아,2
8423,ㅋㅋㅋ 군대 갔다 온 놈들이 주한미군 철수 찬성하는 건 뭐냐,0
8424,ㅋㅋㅋ 미군 철수하면 우리나라 그냥 최약체라고 ㅋㅋ,0
8425,딸 가진 사람은 재혼하지 맙시다,0
8426,니 몸은 니가 챙겨야해 ㅠㅠ,0
8427,또 4단계 연장이라니,0
8428,"OO 공장 불시 점검했는데, 위생관리 부적합 적발했대.",0
8429,그동안 먹은 거 올라온다.,0
8430,"OO 조작 의혹 있자마자인데, 이상하지 않냐?",0
8431,아 코로나 때문에 친구들도 못 만나고 너무 지겨워,0
8432,백신맞고 자위행위 하는 애들은 진짜 프로 인가,0
8433,으 진짜 극혐이고 혐오스럽다,0
8434,남들 옷 입는 것 까지도 니가 신경쓰니?,0
8435,그니까 댄서들 판정 어이없어,0
8436,그래도 예전보다 많이 예뻐진 것 같은데?,0
8437,저 만화영화 진짜 재밌더라,0
8438,특히 여자 캐릭터가 엄청 귀여워,0
8439,엥 너 저런거 봤냐,0
8440,OO는 사고 친 애들 활동 정지 안 시키냐?,0
8441,냄새 안 나게 해서 다른 자식을 지키려는 본능이야.,0
8442,백신 부작용으로 죽을 확률이 로또 맞을 확률보다 높은데?,0
8443,너 바람 핀다는 소문이 돌던데?,0
8444,그거 어떻게 알았어?,0
8445,너 미쳤어?,0
8446,바람 피든 말든 니가 무슨 상관이야?,0
8447,나 아까 씻은 거야;,0
8448,근데 이 냄새는 뭐야 ㅋㅋ,0
8449,니 인중 냄새 아닐까?,0
8450,뭐래 아니거든,0
8451,내기할래?ㅋㅋㅋ,0
8452,몸이 너무 아프다.,0
8453,야 친구가 아픈데 위로를 해야지.,0
8454,됐고 밥 사줄테니까 뭐 먹고 싶은지 말해.,0
8455,오 역시 믿고 있었다구.,0
8456,몸이 너무 안좋아진것 같아,0
8457,그러게 병원에 가라니까,0
8458,병원가면 주사 맞아야 하잖아,0
8459,주사 맞기 싫어서 병원을 미루냐,0
8460,나 선단 공포증 있단말이야,0
8461,커피 맛이 다 거기서 거기 아니야?,0
8462,카페마다 커피 맛 천차만별이지;,0
8463,나는 커피 맛 다 똑같던데...,0
8464,넌 얼마나 고급진 입맛이길래?...,0
8465,우린 먹는 음식부터가 차이 나잖아~,0
8466,OO은 사재기했는 지도 몰랐대.,0
8467,당사자가 어찌 모를 수 있겠나...,0
8468,맞아. 단체 대화방에 자기도 아는 것처럼 글 올림,0
8469,얘 저번에 막걸리 사건도 해명 제대로 안했음,0
8470,이게 사실이라면 진짜 실망스럽다,0
8471,나 학점 망했어...,0
8472,자업자득이지 뭐...,0
8473,어쩌려고 그렇게 놀았어,0
8474,다음 학기의 나한테 몰빵했지,0
8475,너답다 진짜...,0
8476,자신과의 싸움에서 이겨야 몸 만들 수 있는데 왜?,0
8477,OO한테 상대가 안되지,0
8478,그 인간 자체가 애초에 정치할 그릇이 아니었음,0
8479,초등학생들 하는 소리 들으면 소름 돋는다,0
8480,진짜 성악설이 맞는 거 같아,0
8481,그래야 안 나대지,0
8482,관심안가져주니까 본격적으로 도배하는거임,0
8483,내가 여친집에 갔는데 다른 남자랑 자고있더라,0
8484,싸잡아서 말 좀 하지마.,0
8485,쟤는 왜 남친 안 만들고 개랑 붙어있지?,0
8486,개한테 대줬을 수도 있음,2
8487,그런 상상 하지 마,0
8488,예전에 보던 아역배우 훌쩍 커서 이제 못 알아 보겠다,0
8489,여자 사귀는데 기념할 날이 왜 이리 많은 거냐?,0
8490,선물을 챙기려는 거겠지.,0
8491,요즘 OO 작가 책 읽어봤어?,0
8492,어 그 작가 요즘 인기 많더라,0
8493,나도 한 두 권은 읽어 봤어,0
8494,진짜 인기 많나보네,0
8495,나는 아직 안 읽어봤어,0
8496,명명백백 밝혀 올바를 처벌받길..,0
8497,아이돌이 잘생기면 됐지,0
8498,삼성은 이제 전자 사업 접고 군수 사업으로 전환하면 되겠다,0
8499,돼지 통구이 만들어서 북한 주민들 주면 좋아라 하고 먹어치울 듯,1
8500,OO은 왜 남자만 성욕이 크게 그리냐?,0
8501,이것도 남혐 아니야?,0
8502,이거 작가 남자거든?,0
8503,남자 작가한테 가서 따져,0
8504,야 근데 남자들 성욕 센 거 사실이잖아,0
8505,일본 골판지 침대 때문에 우리나라 선수들 피해봤나봐,0
8506,아침부터 김부장이 화나게 한다,0
8507,오늘도 꼬장부렸어?,0
8508,소개팅은 잘 했냐?,0
8509,탄수화물이 부족하면 몸에서 냄새가 난대,0
8510,케톤때문에 몸이랑 입에서 냄새가 나는거라더라고,0
8511,내가 그래서 가끔 몸이랑 입에서 냄새가 나는거였나봐,0
8512,너정도 먹는거면 탄수화물이 충분하지,0
8513,요즘 초등학생들은 예전이랑 다르더라,0
8514,나도 그래서 너무 싫어,0
8515,어리다고 나대는 애들은 진짜 쥐어박고 싶어,1
8516,근데 ㄹㅇ 학교 이미지만보면 연대가 고대 압살하긴 함,0
8517,쟤가 대통령 되면 난 한국 뜬다,0
8518,쟤네 부모도 저러고 다니는 거 알려나 모르겠네,0
8519,저기도 뭔 연예인이 홍보하던 제품 아냐?,0
8520,대한민국이 점점 산으로 간다,0
8521,사람들이 좀 각성했으면 좋겠다,0
8522,저 여자가 결혼 전에 남자 재산 알아내는 법을 유튜브에 올렸어,0
8523,한국여자랑 결혼 전에 처녀막 유무랑 핑두인지 검증하는 방법 올린 유튜버는 없냐,2
8524,남편 바람난 게 아내 잘못은 아니잖아.,0
8525,나 남친한테 거짓말 하고 다른 남자랑 단둘이 술마셨어,0
8526,그걸 왜 나한테 말해?,0
8527,남친한테 미안하잖아..ㅋㅋ,0
8528,그냥 뚱뚱한거가지고 말을 그렇게 해,0
8529,태어나서 저런 흉칙한거 첨 봄,0
