,0,1
24312,그치 ㅋㅋㅋ 그냥 손잡고 다니고 그러더라,0
24313,야 아무리 그래도 죽으라고 저주는 하지 마라,0
24314,비둘기는 유해 조수인데 밥을 주는 사람이 있어?,0
24315,옛날 낭만에 취해서 밥 주는 게 당연한 건 가봐.,0
24316,남한테 피해를 준다는 건 모르는 거지ㅠ,0
24317,누가 따끔하게 한마디 해줬으면 좋겠다.,0
24318,1인 시위하는 아줌마 봤냐?,0
24319,누가 보면 본인이 제일 잘 한 줄 알겠네,0
24320,맞아 옛날 드라마 보면 속 시원함 ㅋㅋ,0
24321,연예인 마약 사건은 어째 다 집행유예로 끝나는 것 같다,0
24322,이제부터 진짜 공부한다.,0
24323,15살 차이면 거의 조카와 삼촌뻘 아니냐?,0
24324,15살 나이 차이가 뭐 어때서?,0
24325,서로 사랑하면 나이 차이가 무슨 상관이냐?,0
24326,아동성애자도 아니고 그럼 그 나이차가 정상이냐?,0
24327,아 우리팀 사수 자꾸 옆에서 꺼억 거리면서 트름하는데 힘들다..,0
24328,으 공기 아깝게 살아있지 말고 제발 죽어줘~ ㅋㅋ,1
24329,오홍홍... 날씨 좋은데 여친이랑 드라이브나 가야겠다. 이게 얼마 만이야?,0
24330,여기 또 기사 엉망이네,0
24331,시끄러워. 밤중이야.달 뜬 거 안보여? 시도때도 없이 떠들어서 잠을 못자겠어.,0
24332,내 귀로 내가 듣고 시끄럽다는데. 별 일이야,0
24333,근데 그것도 조작이라는 거 같던데 당시 OO인구가 30만이 안됐다고,0
24334,나 신발 새로 샀어,0
24335,응 ~ 안물어써~,0
24336,저 식당 엄청 줄 서있는 거 보니 진짜 맛집인가봐!,0
24337,범죄자를 낳은 원조 숙주인데 같이 때려 죽여야지,1
24338,선배 은근슬쩍 만지지 않으시면 좋겠어요,0
24339,나같으면 빡쳐서 주걱으로 뺨 쳤다 ㅋㅋ,1
24340,그래도 걔네는 정의로운 척이라도 하잖냐.,0
24341,정의로운 척 하면서 현실을 외면하기만 하잖아.,0
24342,저기 음식 맛있다는데 먹으러갈래?,0
24343,사진 보여줘봐,0
24344,OO 악마의 편집 모르냐?,0
24345,빨리 이사 가고 싶다,0
24346,오늘 걍 죽을 때까지 마시자~,0
24347,시험도 끝났잖아~,0
24348,야 너 많이 외롭냐? 이런 걸 왜 봐,0
24349,세상에 완벽한 사람이 어디 있겠어.,0
24350,당신 주변에도 없을 거다,0
24351,응~ 군필 인증까지 다 했어~,0
24352,한국 사람들 배 고픈 건 참아도 배 아픈 건 못 참는다,0
24353,그러게 OO 뒤에서 해먹은 거 걸리니까 이제 큰일 난 거 아니냐,0
24354,내가 오늘 맛집 다 알아보고 왔지,0
24355,헐 진짜? 대박이다 기대가능?,0
24356,가능 가능 쌉가능 다 따라오셈 맛집 다 조져 준다,1
24357,지금 기대 만땅이구요,0
24358,이 언니만 따라오셈,0
24359,피부 뒤집어져서 안그래도 스트레스 받고 있다고 ㅠㅠ,0
24360,돈 쉽게 버는 법 없나?,0
24361,그건 범죄 아니야?,0
24362,약하게 보이려고 분장한거겠지.,0
24363,난 광주 갈 때마다 OO 비석 밟고 가잖아.,0
24364,제발 오래오래 고통받으며 살아야 할 텐데.,0
24365,산채로 즈려밟아야 제 맛.,1
24366,난 또 죽었다는 줄 ㅋㅋㅋ,0
24367,오늘 커피한잔할까?,0
24368,너 코로나 확진자아니야?,0
24369,근데 너무 답답해서 미치겠어ㅠㅠ,0
24370,넌 친구가 되서 그렇게 말할 수 있니?,0
24371,너 아직도 아이돌 좋아해?,0
24372,응 아직도 팬클럽 활동하지,0
24373,나 군대 면제야,0
24374,와 부럽다,0
24375,홍삼 사서 부모님 드린다더니 지가 먹는건 방구석 불효자 아니냐 ?,0
24376,맞아요 내 주인들도 보니까 다 지가 먹더라구요,0
24377,친구를 잘 사귀라고 했는데..,0
24378,아니 있긴 하거든!,0
24379,그래서 친구 잘 사귀고 있음?,0
24380,잘 사귀는 건지는 잘 모르겠는데..,0
24381,나랑만 놀아 그럼~,0
24382,쟤는 정말 왜 남을 오해하게 말을 할까?,0
24383,또 남의말 이상하게 옮겼지?,0
24384,말하지 말랬는데 못알아듣더라,0
24385,그래서 나도 긴말 안하고 있다오,0
24386,네가 참아야지 별수없다,0
24387,내 친구 알고 보니 동성애자였어,0
24388,그럼 네 친구가 게이인 거야?,0
24389,응 내 친구 게이래,0
24390,맞아 그래서 절연하려고,0
24391,씻기를 별로 안 좋아하는 것 같아,0
24392,젊은이들 요즘 핸드폰만 보고 그러면 안돼,0
24393,소름돋아 진짜..,0
24394,코 좀 손 보려는데 어떤 각도가 좋은지 좀 봐줘,0
24395,코만 이쁘면 뭐해?,0
24396,잼민이들 개학해서 PC방이 조용하네,0
24397,판매자님~ 옷을 구매하려고 하는데요,0
24398,상세페이지는 없는건가요?,0
24399,고객님들 후기란을 보면 입고 찍으신분들 있으니 그거 보세요,0
24400,돈다발로 맞아야 정신을 차리나?,1
24401,걔 일을 너무 못해,0
24402,틀린 이야기는 아닌데... 쫌..,0
24403,나 속옷을 새로 사야하는데 어디서 사지,0
24404,당연하지 무슨소릴 하는거야?,0
24405,그래서 너는 정말 편하게 런닝만 입고다니나 보다 했지,0
24406,볼품없을 때 옆에 있어 준 여친을 버리냐?,0
24407,너 무슨 말을 그런 식으로 해?,0
24408,된장찌개에 토마토 넣어먹으면 깔끔하고 좋음,0
24409,아 진짜 괜찮다고 ㅋㅋㅋ,0
24410,화장실 몰래카메라 설치 하는 애들은 정상정인 사고방식이냐,0
24411,답도없구나 어떻게 남 변 보는걸 찍어서 팔지,0
24412,옆집 여자 시끄러워 죽겠어,0
24413,밤 마다 진짜 괴롭다,0
24414,쟤 19살인데 얼마전에 임신했대,0
24415,OO 여자랑 결혼하기,0
24416,OO 여자는 계속 돈 들잖아 멍충아,0
24417,여자친구가 생리를 안해..,0
24418,너 여친 임신한거 아냐?,0
24419,이 년이 떡감이 진짜 잘 쪼여서 안에 싸버렸거든,2
24420,달랑 싱글 음원 하나 내고서 돈 벌라고?,0
24421,쟤는 아이돌인데 나이가 스물일곱이래,0
24422,그 정도면 거의 낼모레 서른 수준인데?,0
24423,저 나이에 어떻게 안무를 소화하지?,0
24424,진짜 기적과도 같은일 아니냐,0
24425,잘난척 하는것이 니한테 뭐 피해주나?,0
24426,내 언젠가는 진짜 잘나갈꺼다.,0
24427,우리 동네 초밥집 결국 문 닫음..,0
24428,초밥집 거기 뿐이라 잘 되지 않았어?,0
24429,치매보험 들어놨어 혹시나 해서,0
24430,백팔십 넘는 한입거리도 있냐?,0
24431,신입생들중에 여자애들이 좀 있네,0
24432,말이 심하다ㅡㅡ,0
24433,돈을 빌려줬으면 좀 인내심을 갖고 기다릴줄도 알아야지 자꾸 보채는놈들 진짜 짜증나,0
24434,저 사람 인터넷방송에서 봤어,0
24435,너보다 돈 잘벌어서 훨씬 나은 인생이지,0
24436,너는 머리가 진짜 안 좋구나,0
24437,나 내일 코 수술 하러 가! 너무 기대된다,0
24438,왜?내가 뭐 잘못한거있어?,0
24439,빡쳐서 이모티콘 만들었다가 포기했잖아,0
24440,"잘 봐라, 너가 만든 거 괜찮았으면 베껴서 올릴 수도 있어ㄷㄷ",0
24441,야 그런 말 좀 하고 다니지마라,0
24442,뭐?,0
24443,너는 인상이 너무 구려서 취업할수있겠냐?,0
24444,ㅋㅋㅋ교장이 몰카 설치한 거 들었음?,0
24445,ㅇㅇ 좀 젊은 교장이었던데,0
24446,자식들도 대학 다니고 그럴 나이라고 하더라,0
24447,계절 바뀔 때마다 옷 정리하는 거 너무 힘들어,0
24448,누가 대신 해줬으면 좋겠다,0
24449,군대 다녀왔다는 놈의 체력이 뭐냐 ㅋㅋ 두바퀴 뛰고 헐떡거리냐,0
24450,아닠ㅋㅋ 내가 알아서 할테니까 내 인생에 신경쓰지마,0
24451,너 성형전은 쑥맥처럼 생겼어,0
24452,네다음 성형벌레,0
24453,조사해보면 다 나옴,0
24454,너 한남 특징이 뭔지 알아?,0
24455,냄새 나는거?,0
24456,나는 맞는 말만 하는데 왜 그러냐,0
24457,사람의 감시는 따돌릴 수나 있지,0
24458,위치 정보 제공때문에 일거수일투족이 다 기록이야,0
24459,너 이번주 주말에 뭐해?,0
24460,나랑 데이트 할래?,0
24461,헐 OO 죽었다는데 기사에서??,0
24462,뭔소리야 ㅋㅋ 어느 기관인데 걔가 죽었대,0
24463,나 OO 읽었는데 걔네가 그러더라 ㅋㅋㅋ,0
24464,야 ㅋㅋㅋ 걔네는 공신력이 너무 없잖아 대부분 다 찌라시야 걔네는,0
24465,아 그런거냐 ㅋㅋㅋ 걸러서 읽을 필요가 있겠다 ㅎㅎ,0
24466,키오스크 쓰기 어려워하는 노인들 때문에 소비에도 세대차이가 생기나 봐,0
24467,솔직히 젊은 나도 뒤에 기다리는 사람들 때문에 메뉴 대충 고를 때 있는데,0
24468,우리 놀러 가기로 한 곳 알아봤어?,0
24469,그때 카톡으로 몇 군데 추려서 보냈는데 안봤어?,0
24470,거기 다 별로던데,0
24471,우리 앞집 캣맘에게 고양이에게 밥 주지 말라고 했다가 또 싸웠어,0
24472,"그 여자는 지가 키우는 고양이도 아니면서, 왜 우리가 고양이 시끄럽다는 건 신경도 안쓰나?",0
24473,"그런 인간들은 같은 인간, 특히 남자 죽는 건 신경도 안쓰고 고양이부터 챙길껄?",0
24474,하루짜리 알바를 해도 취업자로 계산하는 통계수치는 믿을 수 없습니다.,0
24475,사회복지서비스가 절반 넘는 28만명이란다.,0
24476,운수창고업은 배송물류업체에 종사하는 인원도 증가하니 늘었지,0
24477,각종 공기관 가봐라.,0
24478,잉여 공무원 척 하는 알바인간들이 얼마나 많은지,0
24479,남성연대 알아?,0
24480,이번에 새로 생겼대,0
24481,요즘 범죄자들 보면 하나같이 키 작은 애들임,0
24482,OO은 저것도 키 수술한 거라며??,0
24483,진짜 요즘 예능에 일반인이라고 나오는 사람이 일반인 맞냐?,0
24484,일반인 아니지ㅋㅋ 누가 저런 갑부가 일반인이냐?,0
24485,돈도 떠나서 얼굴이 넘사벽이잖아,0
24486,하.. 우리 얼굴 눈감아..,0
24487,진짜 개 처절하네 자살이 답임,1
24488,듣보잡 소속사인데 금방 망할 듯.,0
24489,오늘 수업 준비 다했어? 미치겠네 읽을 게 너무 많아서,0
24490,야 너 몰랐어? 오늘 휴강한다고 했잖아,0
24491,웬 휴강? 난 못들었는데,0
24492,아..아까 조교가 문자보냈는데 교수님 개인 사정으로 휴강이라고,0
24493,요즘도 일본 만화 보는 사람 있나?,0
24494,에이 없지..,0
24495,나 보면 배만 좀 볼록하지 않냐,0
24496,너무하네 진짜..,0
24497,신호위반 하셨습니다 면허증 주세요,0
24498,무슨말이요 노란불에 지나왔는데,0
24499,내가 두눈으로 봤으니 변명하지 마세요,0
24500,변명이라니 이양반아 아니라고 증거 돼,0
24501,이사람이 안되겠네 경찰서로 갑시다,0
24502,강제연행할수도 있습니다,0
24503,와 법좋네 죄없는 사람 막 잡아가고,0
24504,마지막 경고입니다 면허증 주세요,0
24505,시민여러분 경찰이 공권력 행사합니다,0
24506,당신을 공무방해로 체포하겠습니다,0
24507,그래가자 나도 변호사 선임하겠다,0
24508,오늘 호텔 꽉 차겠네,0
24509,귀신 분장하는 건 구색일 뿐이지,0
24510,호텔 사장님도 자영업자인데 좋네,0
24511,정부가 해야하는 일이 뭔데?,0
24512,요소수가 부족한 게 왜 정부탓인데 머저리야,0
24513,대깨 인증도 참 가지가지로 한다,0
24514,이게 그럼 수입업자 탓이냐?,0
24515,중국 석탄 수입 못한 기간 오래됐으면 대비했어야지,0
24516,백신 접종하면 사망 97% 예방 된다던데?,0
24517,거짓말하고 있네,0
24518,넌 피부가 왜이래 까맣냐?,0
24519,원래 태어날때부터 까맷는데요,0
24520,너네 아버지는 무슨 일 하시는데?,0
24521,건설일하십니다,0
24522,오늘 생일인데 생일 선물 없냐?,0
24523,변호사나 변리사 등등의 전문직이 아무리 잘 나가도 의치한 미만 잡이야.,0
24524,그게 무슨 소리야?,0
24525,ㅋㅋ너가 뭔 상관이야.,0
24526,OO일 잘해요?,0
24527,응 야무지게 책임감 있게 잘해.,0
24528,다행이네요.OO는요?,0
24529,제가 말해 그만두게 할께요,0
24530,그래 니가 수고좀 해주라,0
24531,저 사람 잘못이지 무슨 지역 탓을 하냐?,0
24532,나를 롤모델로 삼고 노력하는 친구들이 많더라고,0
24533,덕분에 나도 더 열심히 살아야겠다는 다짐을 했어,0
24534,근데 브이로그 나만 웃김?,0
24535,귀여운 사람한테 맞아본 적 있니?,1
24536,자기가 하고 싶은대로 화장하는 거지 뭐,0
24537,뭐? 왜 그래? 갑자기 왜그런데 이상하네,0
24538,아무래도 큰일이야 사람 잘못 봤어,0
24539,오늘따라 날씨도 이딴 식이냐 무기력하네,0
24540,이 시국에 날씨에 기분도 완전 제로임 화가 날 지경이다,0
24541,이럴 수록 담배맛 아이스티를 마셔야지 ㅋ,0
24542,하.. 나도 미치겠어..,0
24543,자기가 먼저 꼬리쳐 놓고 이상한 사람 취급하는 거 보소,0
24544,어떻게 사람이 텐션이 항상 높냐 연예인한테 너무 기대치가 높은 듯,0
24545,그니까 하루에도 기분이 몇 번씩 바뀌는데 연예인은 뭐 사람 아니냐,0
24546,나이 좀 있어야 말이 통하지 않아?,0
24547,"난 너 싫어, 나한테 연락하지 말았으면 좋겠어",0
24548,뭐? 상관없어 ㅋㅋ,0
24549,난 중학교에부터 콘돔을 보급해야 된다고 생각함,0
24550,무책임한 임신을 막는 게 더 중요한거 아니야?,0
24551,오늘은 수요일 잔반 없는 날~,0
24552,와 개이득 빨리 가서 첫빠로 먹어야지,0
24553,종 치자 마자 달려 가자,0
24554,인정 오늘 치킨 나와서 늦게 먹으면 없음,0
24555,와 치킨 개 존맛탱이겠다,1
24556,아니 요새 초딩들 왜 그러냐?,0
24557,무슨 일 있어?,0
24558,비비탄에 맞았는데 사과도 안하고 그냥 도망치더라.,0
24559,진짜 집에서 교육을 안하는 건가?,0
24560,못배운거지 뭐.,0
24561,걔네 오빠 조현병으로 폐쇄병동에 입원해 있대.,0
24562,어제 지하철에서 너무 화나는 일이 있었어,0
24563,또 어떤 사람이냐?,0
24564,"역에서 내려서 문 앞에 있는데, 옆에서 ""비켜""라고 계속하는거야",0
24565,또 나이든 아저씨냐?,0
24566,"아니, 뒤 돌아보니까 늙은 아줌마더라",0
24567,나 집에 가고 싶어.,0
24568,한 게 뭐가 있다고 집에 가고 싶어?,0
24569,저렇게 다치고도 살려고 애쓰는 거 보니 마음 아프다.,0
24570,사랑은 굳이 남과 비교 할 필요 없다고 생각함,0
24571,쟤네 꽤 오래 사귀지 않았냐?,0
24572,어 4년 정도 됐을 걸?,0
24573,4년이면 할 거 다 하고 볼 장 다 봤겠네 근데 오래간다,2
24574,속궁합이 잘 맞아서 몇번 헤어지다가도 속정 때문에다시 만나는 거래 ㅋㅋ,2
24575,OO에서 여자 시신이 발견됐대.,0
24576,이상하네. 대구에서 물에 빠져 죽다니...,0
24577,OO 수심이 얕아?,0
24578,그런 말을 하다니 하늘이 무섭지 않냐?,0
24579,이게 원래 그런 거지 내가 무슨 잘못을 했다고 그래요?,0
24580,무단횡단 사고는 정말 운전자만 불쌍하드라 무단횡단 사망자는 동정1도 안간다,0
24581,저 사람 달동네에서 내려오나봐,0
24582,가슴이 조금 작은 편이어서 항상 콤플렉스로 있었고,0
24583,그게 무슨 말씀이시죠?,0
24584,오빠는 날 얼마만큼 사랑해?,0
24585,평생 너의 보G에 갇혀살 수 있을만큼 사랑해,2
24586,그런 육체적인 사랑말고 정신적인 사랑은??,0
24587,억대돈을 모아서 집사란 말이냐?,0
24588,요즘 유튜브 뭐 보냐?,0
24589,나는 주식 채널 주로 본다,0
24590,그거 보면 도움이 좀 되냐?,0
24591,애널리스트나 연구원들 나와서 정리해주니까,0
24592,먹을게 넘치는데 꼭 멍멍이를 먹어야 해?,0
24593,먹어보면 진짜 맛 좋아.,0
24594,너도 진짜 먹어보면 좋아할꺼라니까?,0
24595,더이상 듣고싶지 않다.,0
24596,왜 무슨일 있었어?,0
24597,OO 사고 배달원들이 산업재해 인정해준다던데?,0
24598,맞아 좀 불쌍하다.. 50대 가장이라던데,0
24599,그런데도 오늘 대구에서 지지자들이 꽃다발 바치고 난리 났어,0
24600,저 사람은 머리속에 뭐가 들었을지 궁금하다,0
24601,쟤 말본새 좀 봐,0
24602,진짜 간호사 극한 직업이다,0
24603,저러는 걸 다 받아줘야 하냐,0
24604,너도 참 힘들겠다 힘내라,0
24605,요즘 백종원 돈가스 때문에 욕먹는 거 봤냐,0
24606,돈이 되는데 안 하는 것도 이상하지 않냐,0
24607,그게 대한민국 현실임 능력도 안 되니 걍 시험으로 어떻게 비벼 보려는 건데 되겠냐 그런 애들이,0
24608,그니까 말이 100:1이지 허수가 70퍼 넘을 듯 말만 공시생이라 하고 노량진 코노 조지는 애들 보면 답 나옴,0
24609,여자에 대해서 환상 갖고 있는 것들은 실상을 모르는 경우임.,0
24610,맞아 여자는 다 좋은 냄새나고 보들보들할 거 같지ㅋㅋㅋ,0
24611,대한민국 원화가 80년 만에 일본 엔화 이김,0
24612,이제 달러 유로에 이은 제3의 통화로 원하가 됨,0
24613,1억 팔천이나 벌었다면서요,0
24614,너 왜 갑자기 책 읽는 척하냐 ㅋㅋㅋ,0
24615,이번에 경찰이 시위를 진압하다가 민간인을 때렸대,0
24616,여자 나이는 크리스마스 케이크라는 말 엄청 화나네,0
24617,욜로 몰라? 한번뿐인 인생~!,0
24618,아 피곤하다~찜질방 가서 몸 지지고 싶다~,0
24619,요새 카페에서 공부하는 사람들 때문에 자리 없다고 카페 이용 시간 제한 걸어두더라?,0
24620,"아니, 내가 왜 그 사람들 때문에 멀쩡한 카페 이용 시간을 침해 받아야 해?",0
24621,나 이번에 만난 애 엄청 찌질하더라,0
24622,여자가 어떻게 했길래 찌질하대?,0
24623,내가 보자는 영화 이미 봤다고 해서 그러려니 했거든,0
24624,근데 그러고 다음주에 다른 남자랑 봤다고 인증샷 올리더라,0
24625,엥 그건 그냥 니가 싫었던 거 아니야?,0
24626,대선 판에 또 무속인 개입하는 건가,0
24627,선거하기 전에 걸려서 다행이야,0
24628,요새는 외벌이로 살기는 힘들다더라,0
24629,난 결혼해도 맞벌이 했음 좋겠어,0
24630,여성들만 나오는 영화 보고 싶다,0
24631,맞아 그리고 우리나라 영화는 내용들이 죄다 뻔해서 다 똑같음ㅋㅋㅋ,0
24632,요즘 비건 유행이야? 엄청 많이 보이네,0
24633,고기도 없이 우째 밥먹어,0
24634,요즘 변비 와서 너무 힘들다,0
24635,변비에 좋은 음식이 뭐가 있지? 혹시 알아?,0
24636,시험이 어렵긴 한가봐,0
24637,열심히 안 한 거지. 부모는 돈 대느라 허리가 휘는데,0
24638,OO 손절못하는 이유,0
24639,OO을 인정해줘서,0
24640,한국 여자들은 왜 한국 남자들을 싫어할까?,0
24641,ㅋㅋㅋㅋ 그런가,0
24642,커피 맛이 이상한데?,0
24643,백신 2차맞고 왔는데 너무 아프다,0
24644,너 지금 반송장 상태야,0
24645,진짜 이거 의료사고 난거 아니냐?,0
24646,OO을 먹어도 나아지질 않아,0
24647,너 그거 진짜 믿고 있었어?,0
24648,정신머리 약한 게 뭐 자랑이라고,0
24649,사지멀쩡한 젊은애들 술값이나 하라고?,0
24650,"비판은 하더라도, 비난은 멈춰주라.",0
24651,똥남아라고 좀 하지마,0
24652,야 넌 사람 말 좀 들어,0
24653,고집이 왜 이렇게 센 거야?,0
24654,머리에 구멍내버리기 전에 다물어라,1
24655,중국은 이제 아예 브랜드를 통째로 베껴버리네,0
24656,이런 건 국가가 소송을 적극적으로 도와야 하는 사안인데…,0
24657,근데 저 브랜드도 그렇지 상표 등록이 빨리 해놨어야지,0
24658,중국인들은 모로 가도 성공만 하면 된다는 마인드라 얄짤없는데 말이야,0
24659,저사람은 좀 1절만 해야해,0
24660,나는 저런 멍청한 녀석처럼 안되어야지,0
24661,운전 똑바로 안 하는 차는 대부분 여자 운전자야.,0
24662,남한테 피해만 주는데 ㅋㅋㅋ,0
24663,사람은 누구나 장애인이 될 수도 있는 거야,0
24664,미래에 너가 저 입장이 될 줄 누가 알아,0
24665,이번 체육 시간에 여자 애들 달리기 시험 본대.,0
24666,그거 성희롱인 거 알지?,0
24667,출동시에 여경 보내는거 어떻게 생각하냐?,0
24668,여경인원은 강력 범죄는 최소화하고 남경 많이 보내야지,0
24669,오늘 핼러윈이라 이태원에 사람들 진짜 많대,0
24670,이 시국에 가는 사람들 보면 한심하다,0
24671,마스크 안 하고 가는 사람들도 많다고 하더라,0
24672,저러다 또 확진자 많이 생기는 거 아닌가 모르겠네.,0
24673,우리 영화 보러 갈래?,0
24674,재밌는거 개봉 했다던데?,0
24675,내가 또 언제 잠만 잤다고 그래!,0
24676,니가 영화를 끝까지 본적있냐?,0
24677,쳇! 너랑은 안갈란다!!,0
24678,100명 단위던데 그렇게 많은 건가요?,0
24679,지하철에서 마스크벗고 침뱉고 다니는 사람 봄?,0
24680,천사병 걸린 새77ㅣ들 말투 개 잦같으니까 제발  77ㅓ졌으면 좋겠다,1
24681,그러니까 ㅋ; 지 혼자 착한척.. 정의로운척 하는거 개 역겨움,1
24682,ㅋㅋㅋ 착한짓 안하면 죽나봐 무슨 ㅋㅋ 누가 목에다가 칼대고 협박하는 듯 ㅋ,1
24683,성폭력 피해자가 한순간에 갑질 가해자가 되네,0
24684,쟤네 컨셉이 우주인이야?,0
24685,개 새기들인가봐요,1
24686,눈이 나뻐져서 안 보이네,0
24687,내가 초등학교도 못 나왔지만 너보단 똑똑해. 이거 왜 이래,0
24688,왜 이렇게 일 처리가 느린거지?,0
24689,에이 그래도 잘하는 사람도 있는데 뭐.,0
24690,원인 없는 결과가 과연 존재할까?,0
24691,"곰팡이같은 존재는 늘 있어, 신경쓰지 마",0
24692,이 세상은 혐오가 넘치는 쓰레기장이야.,0
24693,생일 선물로 오빠한테 명품백 사달라고 해야지~,0
24694,너는 커피 뭐마실래?,0
24695,나는 그냥 아메리카노 마실래,0
24696,그게 무슨 커피야,0
24697,그냥 커피콩 삶은 물이잖아,0
24698,그게 커피가 아니면 뭔데?,0
24699,국어 썜 임신했자나,0
24700,넌 남자친구랑 있을 때 쌩얼 보여준 적 있어? 나는 절대 못 보여줄 것 같은데,0
24701,OO이라니.. 나 피부과 다니면서 치료받고 있어 진짜 스트레스 많이 받는데 너까지 왜 그러니,0
24702,아 피부과 다니고 있냐? 열심히 다녀보셈 내 친구도 피부과 다니고 많이 나아지긴 하더라,0
24703,다이어트는 생각이 없나봐~,0
24704,레전드네 뭐 거의 카스썰 한 편 뚝딱임 ㅋㅋㅋㅋ,0
24705,내가 제목 지어 볼게 어느 날 내가 좋아하는 아이돌이 나한테 고백을?,0
24706,중국에서 한국인 체류자 여권 실수로 소각시켰대,0
24707,전세값이 진짜 올라도 너무 올랐어,0
24708,그러게 너는 어떻게 하는데?,0
24709,나는 그냥 고시원 들어가려고,0
24710,어쩔수 없잖아.,0
24711,이런 시국에 여당을 지지할 수가 있냐?,0
24712,임기말 치고 아직 대통령 지지율 역대급으로 높은 편이던데,0
24713,한국이 그만큼 큰일이 난거다,0
24714,그니까 뭐 기사만 보면 나이 드셔서 모르셨나 보다 했을 수는 있는데 OO극장이네 ㅋㅋ,0
24715,취소표도 겨우겨우 구하는 덴데 그런 어처구니 없는 실수를 한다는 게 말이 안 됨 ㅋㅋ,0
24716,전라도는 대신 밥이 맛있잖아,0
24717,서울시 의원 성추행 사건이 또 생겨다며?,0
24718,내비둬 자기 마음이지 뭐.,0
24719,교복 치마 만든 사람은 분명 남자 아닐까?,0
24720,왜? 여자 교복이면 여자가 만들지 않았을까.,0
24721,너무 감동적이라 OO로 갈아탄다.,0
24722,이 정도 와꾸는 어때?,0
24723,공짜로 대 준다고 해도 못할 듯,2
24724,살려주세요 잘못했어요,0
24725,네일 하는데 여자들 육만원 십만원 쓴다매?,0
24726,회사 여자들 보면 다들 약속이라도 한 듯이 매달 하더라,0
24727,넌 뭐가 아쉬워서 유부녀를 만나냐?,0
24728,스릴있잖아. 몸매도 죽여. 사진 보여줄까?,2
24729,아 됐어. 행동 똑바로 하고 다녀.,0
24730,이 동네는 좀 안전해?,0
24731,네가 그 애한테 그렇게 하는 건 잘못한 거 아냐?,0
24732,최근에 병무청에서 만든 군대 관련 영상 봤냐?,0
24733,어떻게 21세기에 군대 갔다와야 남성이라는 발언을 할 수 있지?,0
24734,"그러게, 그 영상을 보고 오히려 군대에 대한 악감정이 생길 것 같아.",0
24735,아니면 의도적으로 병무청 욕 먹으라고 제작한 영상일 수도 있지.,0
24736,머리가 아파서 잠이 안와서 전화했어,0
24737,너한테 전화한 내가 잘못이지.,0
24738,한 놈 가니 따라간 듯,0
24739,피리부는사나이,0
24740,개그맨들 요즘에 인터넷 활동을 많이 하더라.,0
24741,TV에서 활동할 때보다 더 재밌고 다양한 활동을 하는 것 같아.,0
24742,그냥 멋지고 예쁜 아이돌을 덕질할래.,0
24743,뭐 그건 개인의 자유니까.,0
24744,나는 신체검사에서 공익 판정을 받았어,0
24745,그럼 너는 나라에 공헌하는 게 거의 없네,0
24746,여자 조개는 왜 다 다르게 생겼냐,2
24747,남자 거기도 다 다르게 생겼잖아,2
24748,어제 만난 남자 돈 엄청 많다며?,0
24749,160센치 겨우 넘을 거 같은데 키높이를 엄청 신고 나온거 같아,0
