,0,1
16106,술 먹고 정신 못차릴 것 같으면 거절하고 그만 마셔야지,0
16107,그게 쉽냐?,0
16108,니가 그런 말 안해도 나도 잘 알고 있다~,0
16109,위드 코로나 아직 너무 이른 듯 함,0
16110,맞아 백신 맞아도 코로나 걸리는데..,0
16111,.위드 코로나라해도 팝콘이나 야구장 치맥은 ㄹㅇ 위험할듯,0
16112,이러면 더더욱 나가는거 삼가해야될 듯요ㅠㅠㅠㅠ,0
16113,얘는 발표 퀄리티가 왜 이래?,0
16114,위드 코로나 내일부터인데 가능하겠나,0
16115,OO 거리 난리도 아니던데 진짜,0
16116,나도 다음주 확진자 5천명 예상 중임,0
16117,OO 간 사람들 많아서 위드 코로나 다시 없앨듯,0
16118,요즘 젊은 애들은 현명한데 흠....,0
16119,유세가 아니라 너 이러다가 죽을 수도 있어서 그래,0
16120,OO 이제 그만 해체했으면 좋겠다,0
16121,이번에 영어노래 들고 나온 게 웃기다,0
16122,TV에 계란 후라이 호떡 나오던데 너무 맛있을 것 같아,0
16123,아무리 과거 세탁을 해도 인성이 안 된 사람은 티가 나기 마련,0
16124,왜 책을 사놓고 안 읽어,0
16125,나중에 읽으려고 산거거든,0
16126,그냥 가오용으로 산 거 아냐?,0
16127,ㅋㅋ 무인 아이스크림 집에서 절도하는 애들은 뭐냐,0
16128,튈 거면 cctv에 얼굴이라도 나오지 말던가 ㅋㅋㅋ,0
16129,리유저블컵 받으려고 1시간이나 줄을 서?,0
16130,무슨 근거로?ㅋㅋㅋ,0
16131,OO 어린데 몸매 좋다.,0
16132,ㄴㄴ 몸매가 뭔가 만지기 부드럽지 않고 세보임,2
16133,그래도 외모는 연예인 하기엔 충분하다고 생각,0
16134,난 이제 뼈해장국 먹으러 가야겠다,0
16135,넌 오늘 저녁 뭐 먹냐?,0
16136,나 샌드위치 먹으려고,0
16137,엥 갑자기 웬 샌드위치를 먹어?,0
16138,아 나 다이어트 시작했잖아,0
16139,OO이 키운대,0
16140,OO 진짜 보살이다 착해ㅠ,0
16141,속옷을 안 입으면 본인은 편할지라도 보는 사람은 불편함.,0
16142,그런 것까지 배려해달라고?,0
16143,저런 애랑 한 번 자봤으면 소원이 없겠다.,2
16144,여고랑 남고랑 왕따 어디가 더 심해?,0
16145,인기를 말아먹은건 아니지 인스타 팔로워나 보고 말해,0
16146,생긴 걸로 4급을 준다고?,0
16147,어떤 유튜버 백신 접종 후기 보니까 온몸에 멍이 들어있더라.,0
16148,야 그래도 없는 말을 그렇게 지어내기야 하겠어?,0
16149,맨날 마감 늦는 거 진짜 화난다,0
16150,이 트랜스젠더 유튜버는 화장 실력이 점점 좋아지고 있는 것 같아.,0
16151,처음에는 화장이 어색했는데 이제는 자연스러워졌어.,0
16152,"내가 보기엔 이 유튜버, 아직도 화장이 어색한 것 같은데?",0
16153,그건 너가 이 유튜버에 대해 선입관이 있어서 그런 듯.,0
16154,집 값이 이렇게 올라서 뭘 할 수 있겠냐,0
16155,50 되기전에 서울에 집이라도 장만할 수 있을지 모르겠네 ㅋㅋ,0
16156,저게 캐릭터니까 그런 거 아니야?,0
16157,방송에서 캐릭터 잡아놓으면 기억에도 남고 좋잖아,0
16158,이제 이 게임도 조금만 더 하면 마스터 달성이야,0
16159,벌써 마스터라고?,0
16160,부러우면 부럽다고 해,0
16161,괜히 시비걸지 말고,0
16162,뻔뻔하게 영화도 잘 찍던데 피해자들만 불쌍,0
16163,중국인들 어디 가면 OO 만수무강하소서 복창해야함,0
16164,10억 넘는 나라를 저렇게 통제되는 것도 신기하다.,0
16165,무단횡단하는 사람들 보면 진짜 대단하지 않아? 안 무섭나?,0
16166,솔직히 그게 맞는 거 같아 그 사람 때문에 피해 보는 거니까,0
16167,열등감 느끼는게 아니고 방송에서 거짓말을 하니까 그렇지,0
16168,OO 올림픽 나라 소개 수준 실화냐?,0
16169,OO는 윤석열 죽이기에 신났네,0
16170,토론 때 보면 아주 공격적이던데,0
16171,"OO 아들놈은 조기 축구도 했다는데, 뭐가 산재야?",0
16172,OO 아들놈이랑 절친하면 되겠네.,0
16173,OO 아들도 추가해야지.,0
16174,"OO 딸은 왜 빼냐, 서운해서 울겠다.",0
16175,자기들끼리 좋다고 잘 사는데 남들이 왜 이래라 저래라야,0
16176,카드로 100만 원 더 쓰면 10만 원 돌려준대.,0
16177,니 인생보단 내 인생이 훨씬 낫다,0
16178,OO만 심사하고 나머지 둘은 누구야?,0
16179,OO도 처음 보는 애야,0
16180,집에 가기 싫다.,0
16181,그럼 죽어.,1
16182,죽으면 집도 안 갈 수 있어.,1
16183,너 싸움 좀 한다고 소문났더라?,0
16184,내가 뭔 짓을 하든 니가 뭔 상관인데?,0
16185,야리까지 말고 한판 붙자,1
16186,아 갑자기 말 너무 많이 해서 배고프다,0
16187,너는 맨날 배고프잖아,0
16188,경찰이랑 투톱인데 지나칠 정도로 성역화됨,0
16189,쟤도 참 피곤할 거야,0
16190,다 자업자득이긴하겠다,0
16191,그래도 엄마인데...어쩌지? 죄책감이 드네,0
16192,하천 물에 차 담그고 세차하는 사람들 사진 봤어?,0
16193,OO가 뭔 잘못을 했냐?,0
16194,동물보호단체에서 열악한 환경에 있는 강아지들 모아서 방치하다가 결국에는 안락사했데,0
16195,더듬어만진당 또또 신작 떴다 ㅋㅋㅋ,2
16196,요즘 가요들 영어를 너무 남발하고 있는 게 문제야,0
16197,왜 또 시비야 뭐가 또 불만인데,0
16198,하루종일 아이만 쫓아 다니다 보면 나도 집 치울 시간 없어,0
16199,정기공채를 하는 기업들이 갈수록 줄어드네,0
16200,원래 남자들은 자존감이 높대,0
16201,내가 어쩌자고 이런 주식에 들어왔지?,0
16202,꼴랑 몇 프로 떨어졌다고 울상이냐?,0
16203,남자가 인정할 건 인정해야지,0
16204,그래서 내가 강단있는 OO을 좋아하지,0
16205,스님들 고기 안먹고 어떻게 사는거야?,0
16206,비건들이랑 똑같이 사는거지,0
16207,난 고기 없인 하루도 못살겠던걸?,0
16208,스님들 몰래 고기 구워먹고 사는거 아닐까?,0
16209,그렇게 까지 고기를 먹고 싶겠어?,0
16210,OO 가망이 없어서 부들거리는 거 이해합니다 ㅋㅋ,0
16211,착각은 자유라지,0
16212,OO 논란 시기가 아쉽다.,0
16213,실력도 좋고 한창 주가 오를 때였는데....,0
16214,맞아. 대응이라도 잘  하지ㅠ,0
16215,독일은 선진국인데도 cctv가 없어서 범죄를 못 잡네.,0
16216,저기서 살인 저지르고 튀면 완벽범죄 가능 아니냐?,1
16217,독일도 일반 시민들 빼고 노숙자들 겁나 많더라,0
16218,당신들 가족 중에 배달갔다가 사고로 세상떠나도 그런말 쉽게 할 수 있나요?,0
16219,듣고 싶은 것만 듣는 우리 대통령,0
16220,요즘 할리우드에 흑인 배우들이 많아지고 있대,0
16221,능력 없으면 중소 들어가지 왜 꾸역꾸역 대기업 들어갈려해?,0
16222,회사 박회장 지분이 얼마야?,0
16223,박회장 42프로 소유하고 있어,0
16224,그 영감이 그렇게 모았대?,0
16225,영감탱이 욕심 많네,0
16226,오늘 미용실에서 조선족인 것 같은 사람들이 테이블에 다리 올리고 열라 큰소리로 떠들고 있더라고,0
16227,중국어는 성조가 많아서 그런지 좀 볼륨도 높고 시끄럽고 하기는 하니까..,0
16228,그래서 내가 다리 내리고 좀 조용히 해달라 그랬더니 그냥 '예~'이러고 다시 떠들고..,0
16229,그냥 그러려니 해야지 어쩌겠냐..,0
16230,더 큰 문제들이 많은데 텀블러만 갖고 논쟁하는게 문제임,0
16231,이제는 대통령 딸이 청와대 산다고 욕하냐?,0
16232,너네 이제 OO 대통령 더 이상 깔 거리가 떨어졌구나,0
16233,코로나도 정리되어 가니까 깔 거리 찾느라 고생이 많아,0
16234,독립해서 산다고 재산 고지도 안 했잖아,0
16235,니들은 정권교체 당해도 마땅하다,0
16236,OO이 페미 손절하면 누구 뽑을 거임?,0
16237,당연히 OO이지,0
16238,역시 OO 표 냄새는 기가 막히게 잘 맡는다니까,0
16239,형수 성기 찢는다는 놈이 곧 당선되게 생겼네,0
16240,페미 없이 행복하게 살 수 있겠네,0
16241,OO 동화책 작가 데뷔했네,0
16242,수술하는데 그럼 부위 안만지고 하냐?,0
16243,의사들이 다 니같은 줄 아네,0
16244,의사들은 수술하는데 그런 생각할 겨를이 없어.,0
16245,러시아인한테 물어봤는데 일본은 인종차별 안심하대,0
16246,역시 세계 최고의 정치 체계인 공산주의가 답인거 같아,0
16247,15억 인구로 성장 못하는 나라가 이상한거 아님?,0
16248,너 뒤에서 내 욕 하고 다녔다며?,0
16249,ㅋㅋㅋ 어떻게 알았어?,0
16250,이제라도 알았으면 다행이네,0
16251,그래도 너 집 살 바에 내 집 살래,0
16252,OO 이번에 대선 출마함.,0
16253,진심  빨리 죽이든가 해야지 어휴.,1
16254,왜? OO가 어때서.,0
16255,공약도 완전 좋던데.,0
16256,그 문제랑은 별개지,0
16257,아무리 그래도 너보다야 내가 낫지 않겠니?,0
16258,이 형이 정치한다고 깝치는 걸 보면 우리나라 정치인들 다 반성해야 함,0
16259,그런 사람들을 뽑은 너도 반성 좀 해,0
16260,저 음식 먹고싶다..배고파.,0
16261,그래 안먹을게 그만들해,0
16262,사건 현장에서 피해자 냅두고 도망간 여경은 진짜 뭐냐,0
16263,그래도 경찰직 해제 됐던데,0
16264,피해자가 더 크게 다칠 수도 있는 상황인데 자기 임무를 못한거잖아,0
16265,맞는 소리인데 현실적으로 힘들지,0
16266,니가 가서 말해보던가 ㅎㅎ,0
16267,OO 근데 좀 안타깝다.,0
16268,진작에 독자출마 했으면 그때 대통령 됐을텐데...,0
16269,하필 OO한테 속은 것도 안타까움,0
16270,이번엔 OO 도와주지,0
16271,OO 어차피 나한테 맞아서 내일 죽을텐데 도와줘봤자다,1
16272,너 열이 이렇게 나는 거 보니까 코로나 걸린 거 같은데?,0
16273,나 코로나면 너한테 꼭 옮겨준다,1
16274,이놈 이거 안되겠네? 한판 뜨자,1
16275,내가 무서워 할 줄 알고? 덤벼라 이놈아,0
16276,저 수술도 불법이라며?,0
16277,얼굴이 고양이 상이야,0
16278,우리 가족한테 강아지는 진짜 소중한 존재야,0
16279,여자를 때려서 죽이는 놈이라니,0
16280,OO는 드라마 찍을 때 마다 남자배우한테 적극적이더라,0
16281,쟤는 남자면 그냥 다 대줄 듯,2
16282,그래서 나는 레즈는 괜찮다고 생각해,0
16283,엥 그게 무슨 말도 안되는 소리야?,0
16284,에이즈 퍼뜨리는 건 이성애 동성애 상관없어,0
16285,나 요즘 들어 동성한테 매력을 느끼는 것 같아.,0
16286,왠지 모르겠지만 동성이랑 사귀어 보고 싶다는 생각이 들어.,0
16287,너가 최근에 동성애 관련 영화를 봐서 그런 생각이 들 수 있어.,0
16288,늦기 전에 나랑 같이 정신과 치료 받으러 가자.,0
16289,어떻게 사람이 개를 먹을 수가 있어?,0
16290,먹든 말든 내 자유야,0
16291,남이 밥 먹는 거에 시비걸지 말고 유기견 봉사나 해,0
16292,그래놓고 남자가 쓰레기라고 하지않냐?ㅋㅋ,0
16293,피피엘이 너무 많이 들어갔다,0
16294,내용도 그냥 그렇더라구,0
16295,OO 사는 애들은 뭐 보고 사는거냐,0
16296,디자인이랑 보안이지 ㅋㅋㅋ,0
16297,절도범 만들지 말고 알바생 쓰라니,0
16298,어느날 갑자기 길에서 즉사하는 것 보단 이렇게 고생하는게 낫다고 본다,0
16299,무슨 말이야?,0
16300,"아씨, 딱지 끊기겠네. 너는 벙어리 같이 안말리고 뭐했냐?",1
16301,왜 내탓을 해?,0
16302,뭐라고? 진짜 너까지 나한테 왜 그러냐?,0
16303,회색 츄리닝 입은 남자 아이돌 거기 봐봐 ㅋㅋㅋ,2
16304,완전 튀어나와있네 ㅋㅋㅋ 자신있나 본데? ㅋㅋㅋ,2
16305,야... 이건 좀....,0
16306,저거 그림자 때문에 부각되어 보이는 거임.,0
16307,움직이는 영상 보면 저렇게 안보여.,0
16308,"나 새우 못 먹는데, 새우 시켰어?",0
16309,"아 맞다, 미안해. 알러지 있는거 까먹었다",0
16310,내가 저번에도 말 했는데... 기억 해주면 좋겠다,0
16311,OO가 영어로 노래하네,0
16312,노래연습이나 더 해야 돼 걔네들은,0
16313,신음소리 큰 여자랑 하면 내가 잘하는 것 같고 기분 좋음,2
16314,신음소리에 비음 잘섞는 여자가 존꼴이지 않냐,2
16315,남자는 통풍이 중요해서 오히려 치마가 좋대,0
16316,총 맞으라하는 건 괜찮고 남 조롱하는 건 안되나보네,0
16317,어쩐지 젊었을 적에 양아치 연기 하나는 잘 하더라,0
16318,얘한테 양아치 연기 배워 간 OO 의문의 1패,0
16319,죽기 전에 꼭 해야하는 게 뭘까?,0
16320,몇몇 네티즌이 문제야,0
16321,근본적으로 정치인이 잘 해야지,0
16322,나 그 선배한테 도와달라고 연락했었는데 문자 읽고도 답장이 없다,0
16323,OO이 이겼으면 좋겠음,0
16324,솔직히 OO한테 실망한 사람들 많아서 어려울듯?,0
16325,OO한테 실망할 게 있나?,0
16326,그렇다고 OO이 훨 메리트 있는게 아니라서 ㅠ,0
16327,OO도 논란 많잖아 솔직히,0
16328,학관 문구점 가서 필요한 것 좀 사오고 할거 하고 올게,0
16329,왜 잘못한 것도 없는 나한테 그래?,0
16330,"응, 네 잘못은 없고 되려 내가 널 좋아해서 네가 내 몸속에 들어온 것 같아.",0
16331,지금 내 자궁에서 나오는 피가 네 피가 될 것 같거든.,1
16332,중고나라엔 왜 이렇게 거지들밖에 없냐,0
16333,구걸도 적당히 해야지,0
16334,맞아 나도 당해봤어,0
16335,OO 직원들이 거절했어.,0
16336,이번 분기 신작애니 봤어?,0
16337,아직 못봤는데 재밌던데,0
16338,왜 갑자기 시비걸고 그래요?,0
16339,파오후들 냄새나니까 제발 입열지 말아줘,1
16340,일부 국민들은 이 시간에도 OO을 외친다,0
16341,그런 사람들은 왜 그럴까?,0
16342,명품 사는건 괜찮은데 댄디한 스타일이 더 어울릴듯,0
16343,동거는 여자가 잃는 게 너무 많다,0
16344,꼭 OO 뽑을게,0
16345,우리도 늙을 텐데 너무 그러지 말자,0
16346,ㅇㅇ 초밥 먹었는데 왜?,0
16347,초밥은 무슨 맛으로 먹냐?,0
16348,나는 초밥 별로 안 좋아하거든.,0
16349,나는 초밥 좋아해서 자주 먹어.,0
16350,아줌마 팬들 이번에 진짜 선 넘네,0
16351,누가 아줌마들 계몽 좀 시켜라,0
16352,OO 관리 참 잘하고 이쁘다 이뻐,0
16353,이제 곧 53살인데 고급스러움,0
16354,맞아. 와인 같다고 해야하나....,0
16355,40년동안 밀가루는 입에 대지도 않는다던데 대단함,0
16356,진짜 노력해서 더 이뻐보임,0
16357,일본 애들은 속마음을 절대 얘기 안한다더라.,0
16358,왜? 니 여자친구가 또 너보고 뭐라고 했어?,0
16359,내가 여사친이랑 밥 먹었다고 화내잖아,0
16360,남자가 이해해 줘야지,0
16361,아들이 대기업 다닌다고 자랑하고 다닌 살인마,0
16362,그건 쟤가 얼굴만큼이나 성격도 좋고 착하니까 그렇지!,0
16363,최상급은 아니고 더한 범죄도 많죠,0
16364,여성이 이런 류의 범인인 게 드문 사례라 이슈가 됐을 뿐,0
16365,나 돈 좀 빌려주라,0
16366,네가 무슨 상관임?,0
16367,OO 그럼 이제 활동 안 하는 건가?,0
16368,제대하면 조심스럽게 나와서 활동 할 듯,0
16369,그냥 사는 거지 뭐. 걔네가 연예인 하려고 얼마나 힘들었겠냐?,0
16370,하긴 걔네도 쉽게 포기는 못할 거 같다.,0
16371,할아버지도 너무하시지,0
16372,나한테 왜 탈모를 물려주신 거야,0
16373,안그래도 슬픈데 말을 꼭 그렇게 해야겠니,0
16374,이번에 어떤 중딩 잼민이가 엄마 카드로 별풍선 140만원 쐈대ㅋㅋ,0
16375,그 비제이는 무슨 죄냐 ㅋㅋ,0
16376,그래서 환불 안 해준다고 못 박았다던데.,0
16377,아 변비 때문에 며칠째 큰 볼 일을 못 봤어,0
16378,B급 연예인이 수산업자한테 몸을 팔든 관심없고 다른 떡밥 없음?,0
16379,이제 나이 먹은 사람은 못 만나겠더라.,0
16380,연봉이 1억이라도?,0
16381,이걸 맞대응 하는 게 오히려 손해인 것 같은데.,0
16382,한국 드라마에 빠져서 한국 남자 좋아하는 여자들 줄 서 있어ㅋㅋ,0
16383,신랑보니 연애 1도 못 해봤을 것 같은 순진한 남자랑 결혼했더라,0
16384,OO은 진짜 아직 슈퍼스타인가봐.,0
16385,파급력 진짜 쩐다.,0
16386,"그니까, 데뷔한 지 꽤 됐는데 검색 순위 매번 높네.",0
16387,물건을 이런 걸 팔면 어떡해요?,0
16388,고객님 가습제 사용하시면서 불편하셨어요?,0
16389,말씀이 좀 지나치시네요,0
16390,내 돈주고 샀는데 물건이 효과가 없잖아요,0
16391,불량일 수 있으니 물건을 가져와주세요,0
16392,아니 직장인이 왜 대학생 활동에 껴서 민폐지?,0
16393,진짜 열받게 하네,0
16394,왜 무슨 일 있어?,0
16395,아니 지 일해야한다고 회의를 12시에 하재잖아,0
16396,그건 또 뭔 말도 안되는 짓거리야?,0
16397,담당자한테 그 ㅅㄲ 꼰질러서 잘라버려,1
16398,야 OO 네가 그렇게 잘났냐,0
16399,ㅇㅇ ㅈㄴ 잘났다ㅜㅜㅜ,1
16400,킹받아 잘났으면 컴백을 해ㅜㅜㅜ,0
16401,OO 너무 재밌어,0
16402,내가 재밌다는데 왜 그래,0
16403,너도 해봐. 은근 재밌다니까,0
16404,술 먹고 저게 뭐 하는 짓이냐,0
16405,우리 부장님 계속 나한테 어깨동무해,0
16406,혹시 부장님 남자야?,0
16407,맞아 남자야,0
16408,내 노래실력 좀 늘지 않았어?,0
16409,달달한 과자 먹고 싶은 그런 기분 뭔지 알지,0
16410,야 나 지금 공짜 고기 먹었어 ㅋㅋ,0
16411,너 그러다가 고소당해,0
16412,거기 사장님은 귀찮은지 그냥 넘어가더라고,0
16413,일본이라는 나라는 왜 그렇게 인정받는 건데?,0
16414,우리보단 선진국이지 ㅋㅋ,0
16415,욕먹어 오래오래도 사네요,0
16416,넥슨 일본 회사인데 왜 한국이라 하냐?,0
16417,일본으로 본사 옮긴지가 언젠데,0
16418,과연 하느님이 그렇게 편협하신 분일까?,0
16419,이번에 새로 오신 교수님 최연소라는데 너무 대단하시더라,0
16420,SNS 중독자도 아니고 맨날 사진을 그렇게 올려?,0
16421,재밌잖아~,0
16422,너나 나한테 관심 좀 꺼주라.,0
16423,백수라고 할 일 없는 건 아니다.,0
16424,무능력한 경찰들 덕분에 진범을 평생 못잡았네,0
16425,학폭한 애들이 그립다고???????????????,0
16426,찐배구팬이면 이런 말 못 해…,0
16427,그거 너무 잔인한 소리 아니야?,0
16428,그렇지만 하등 쓸모가 없잖아,0
16429,쓸모 없다고 죽어야 하는 건 아니야,0
16430,내 말은 죽는 게 더 도와주는 거라는 거지,0
16431,지금 남편이랑 결혼 한게 후회돼요,0
16432,그러면 이혼하세요,0
16433,우리나라는 동쪽 서쪽으로 고통받네,0
16434,거기에다 북쪽엔 북한이 있어,0
16435,야동 보다가 우리 새엄마 들어와서 식겁했다.,0
16436,불법촬영을 대체 왜 하는 거냐?,0
16437,범죄자 마인드에 어떻게 공감을 할 수 있겠어,0
16438,아 오늘 여자친구랑 헤어져서 한참을 울었다..,0
16439,암흑기 시작인 거지,0
16440,OO도 다 맘에 안 든다,0
16441,결혼할 때 부모들이 이혼 가정이라고 편견가지는 거 어느 정도는 이해돼,0
16442,애정결핍도 결국 사랑받고 싶다는 마음이 집착이 되는 건데 왜 이렇게 극단적으로 부정적인 말만 해대는 거야?,0
16443,그래도 시댁 어른들은 보기 좋다고 살빼란 말씀 잘 안하셔,0
16444,여러분 먹금하세요 괜한 관심 주지 말고,0
16445,동시에 발사되는거 아니면 군인 6명이서 총 6개 들고 쏘는게 더 좋지 않음?,0
16446,배꼽 보일듯 배나온 것 봐,0
16447,어디서 저런 걸 배워오나 몰라,0
16448,지하철에서 주식매매창 계속 보길래 신기했으,0
16449,저 여자 연예인 성격 너무 좋은 것 같아,0
16450,아니 그래 보인다는 거지,0
16451,그냥 자기 잘못 인정하고 반성했으면 이렇게 욕먹지는 않을텐데,0
16452,아직 정신적으로 덜 성숙한 것 같아,0
16453,이번 기회에 좀 배웠으면 좋겠다,0
16454,정치적 자산이 저것뿐이라 아쉽네,0
16455,있는 거 써야지 어떡해,0
16456,지지리 궁상으로 사는 것도 팔자야,0
16457,근데 진짜 안 씻어도 냄새 안 나는 사람이 있다니까?,0
16458,내 친구 저번에 3일 안 씻었다고 해서 뭐야 하면서 냄새 맡았는데 아무 냄새 안 나서 놀람,0
16459,물가가 너무 높아서 그냥 집에서 해먹는 게 나아,0
16460,비품 정도야 뭐 얼마 안하는데 챙겨 가봤자임,0
16461,급한 일이 있어서 그랬어 미안해,0
16462,미안해 잠을 설쳤구나?,0
16463,솔까말 걔도 공범아냐 사리분별 판단할 나이인데 부모가 가짜서류 만드는데 공조한 거잖아,0
16464,어제 길에서 대형견이 입마개도 없이 으르렁대는데 너무 무섭더라,0
16465,입마개는 커녕 목줄을 안하는 개들도 엄청많아,0
16466,뉴스보면 그런 개들한테 물려서 뼈도 부러지고 피부이식수술도 받더라,0
16467,개들이 문제가 아니라 주인이 문제이지,0
16468,나 회사 때려치고 술집이나 해야겠어,0
16469,OO 할로윈 축제는 왜 규제 안함?,0
16470,이러다가 집단 감염 다시 속출하게 생겼네,0
16471,격하게 공감합니다.,0
16472,나 요즘 고민이 있어.,0
16473,무슨 일인데 그래?,0
16474,내 성적이 낮아서 고민이야.,0
16475,너 말이 좀 심하다.,0
16476,이야 이번 문제는 엄청 큰데?,0
16477,나도 나름 해결해보려고 한 건데 어쩔 수 없었다구ㅠㅠ,0
16478,에휴 내가 도와줄테니까 오늘 안으로 끝내보자.,0
16479,정말 나는 너밖에 없다ㅠㅠ,0
16480,내가 언제?,0
16481,OO는 매번 대선 나오는 느낌이야.,0
16482,응 근데 중간에 중도사퇴 많이했음,0
16483,괜찮은 사람 같던데 왜 자꾸 사퇴하는거야?,0
16484,OO도 비리나 논란이 있긴 해,0
16485,개가 무시했나 개를 때리고 난리야,0
16486,엥 평범하다고? 완전 개성있는 마스크인데,0
16487,걔 무죄다.,0
16488,아니다 진짜 무죄다.,0
16489,내가 모르는 뭔가 있나?,0
16490,어 제대로 다시 알아봐바,0
16491,팬의 찌질함과 가수의 오만함을 너무 잘 풍자함,0
16492,남돌들은 다들 본업 열심히 하는데 왜 남돌들한테 이딴 댓글이 달리지,0
16493,너 아직도 OO 보냐?,0
16494,그 프로그램 아직 안 망함?,0
16495,왜 이번에 목소리로 벌써 유명해진 애도 있던데,0
16496,급식이들이 따라할 정도면 뭐 망하진 않았나보네,0
16497,그렇게 잘났으면 네가 찬찬히 설명 좀 해 봐라,0
16498,OO 후보는 어때?,0
16499,왜 난 좋던데 똑똑하잖아.,0
16500,고려해볼 사람이 늘어나면 좋지 뭐.,0
16501,소속사에서 프라이빗하게 데이트장소를 만들어 준다는데,0
16502,아이 낳으면 내 성 따르게 할 거야,0
16503,아 이혼 가정인 줄 오해하고 남들한테 받는 의심 간섭은 어떻게 할 건데?,0
16504,어제 라면을 먹었는데 육개장사발면 면이 조금 더 작아진 느낌이야,0
16505,OO 같이 할까?,0
16506,너 아직도 그런 게임하냐?,0
16507,아직 재밌는 게임인데?,0
16508,그거 확률 조작해놓은 게임 아니냐?,0
16509,아무리 후달려도 그렇지 손에 王자를 새기냐 ㅋㅋ,0
16510,그래놓고 하는 변명 좀 봐,0
16511,되팔아봤자 차익이 뭐 얼마나 남는 장사라고 저러고 있는지,0
16512,친일행적있는 보수신문보다 쟤네가 훨씬 양심적이다,0
16513,OO은 지난 논란도 그렇고 거짓말이 입에 붙으셨나.,0
16514,좋은 실력과 사회성 가지고 있던데 아쉬움,0
16515,맞아 왜 이런 최악의 대응을 하는걸까,0
16516,관상의 중요성을 새삼 느낍니다,0
16517,사건이 끊이지 않네.,0
16518,나도 나이 듣고 놀라긴 했는데 이런 얼굴이 은근 안 늙어,0
16519,이 얼굴로 오래가니까 나중되면 좋을 수도?,0
16520,부모들은 대체 뭐하는 거야?,0
16521,애들이 그 나이 때 뛰어다닐 수도 있지,0
16522,어떻게 애들을 하나하나 통제해,0
16523,나는 안 그랬는데?,0
16524,그냥 저 애들 부모가 교육을 제대로 못 시킨 거야,0
16525,여친을 진짜 사랑한다면서 여친 못 놔주는 건 무슨 심보야?,0
16526,남들 하나 살까 말까한 가방을 몇 개나 가지고 있던데.,0
16527,OO이 그래이의 50가지 그림자 찍어줬으면 좋겠다,0
16528,그럼 진짜 섹시하긴 하겠다,0
16529,걔가 채찍으로 여자 엉덩이 때리는거 보면 바로 자위각이야,2
16530,세상 말세다 말세야.,0
16531,요새도 등산 같은 거 많이 가나?,0
16532,코로나 시국인데 등산 가도 돼?,0
16533,엥? 20대 여자끼리도 가는 게 등산이야,0
16534,90%는 너무 일반화 한 거 아니야?,0
16535,밥 먹을 때 소리 좀 안 내면 안 돼?,0
16536,지금 너 말 다 했어?,0
16537,남돌들은 요새 거의 모르겠다.,0
16538,코로나라서 행사를 못 돌아서 그럼,0
16539,듣보잡인지 아닌지 니가 어떻게 판단해,0
16540,내가 정리 덜 됐다고 했잖아,0
16541,이사 온지가 몇달은 된 것 같거든?,0
16542,바빠서 치울 시간이 없었어,0
16543,친구들하고 놀다보니 좀 늦었네.,0
